{"$schema":"https://json-schema.org/draft/2020-12/schema","$id":"https://thedailyline.bet/schemas/video/v1/platform-metric-snapshot.schema.json","title":"PlatformMetricSnapshot","type":"object","additionalProperties":false,"required":["schema_version","snapshot_id","platform","external_post_ref","publication_package_ref","publication_package_digest","observed_at","observation_window_ref","source_metrics","normalized_metrics","adapter_ref","adapter_release","snapshot_digest"],"properties":{"schema_version":{"const":"platform-metric-snapshot.v1"},"snapshot_id":{"$ref":"common.schema.json#/$defs/Id"},"platform":{"type":"string","minLength":1},"external_post_ref":{"$ref":"common.schema.json#/$defs/Ref"},"publication_package_ref":{"$ref":"common.schema.json#/$defs/Ref"},"publication_package_digest":{"$ref":"common.schema.json#/$defs/Digest"},"observed_at":{"$ref":"common.schema.json#/$defs/Timestamp"},"observation_window_ref":{"$ref":"common.schema.json#/$defs/Ref"},"source_metrics":{"type":"object","additionalProperties":{"oneOf":[{"$ref":"common.schema.json#/$defs/DecimalString"},{"type":"null"}]}},"normalized_metrics":{"type":"array","items":{"$ref":"#/$defs/NormalizedMetric"}},"adapter_ref":{"$ref":"common.schema.json#/$defs/Ref"},"adapter_release":{"$ref":"common.schema.json#/$defs/Ref"},"snapshot_digest":{"$ref":"common.schema.json#/$defs/Digest"}},"$defs":{"NormalizedMetric":{"type":"object","additionalProperties":false,"required":["metric_name","value","unit","normalization_version","source_metric_refs","semantic_notes"],"properties":{"metric_name":{"type":"string","minLength":1},"value":{"oneOf":[{"$ref":"common.schema.json#/$defs/DecimalString"},{"type":"null"}]},"unit":{"type":"string","minLength":1},"normalization_version":{"$ref":"common.schema.json#/$defs/Ref"},"source_metric_refs":{"$ref":"common.schema.json#/$defs/RefSet"},"semantic_notes":{"type":"string"}}}}}
