{"schema_version":"platform-metric-snapshot.v1","snapshot_id":"metric.tiktok.fixture.1h","platform":"tiktok","external_post_ref":"tiktok-post-fixture-001","publication_package_ref":"pub.mlb.sf-lad.1a","publication_package_digest":"sha256:0cfa98f5b4db822601a3eab4fdffd37ffe634547d6e19ae0c76167d324c03cf2","observed_at":"2026-09-08T17:15:00Z","observation_window_ref":"1h.v1","source_metrics":{"views":"1000","watch_time_seconds":"9800.5","shares":"18"},"normalized_metrics":[{"metric_name":"views","value":"1000","unit":"count","normalization_version":"tiktok-metrics.v1","source_metric_refs":["views"],"semantic_notes":"Provider-native view count."},{"metric_name":"watch_time_seconds","value":"9800.5","unit":"seconds","normalization_version":"tiktok-metrics.v1","source_metric_refs":["watch_time_seconds"],"semantic_notes":"Provider-native watch-time total."}],"adapter_ref":"tiktok-metrics-adapter.v1","adapter_release":"fixture","snapshot_digest":"sha256:0cf625c31e9f62640f04b687a86dc14d902cf1e1856479defaa26edeff40fb21"}
